{
  "aggregate": {
    "status": "NOT_RUN"
  },
  "evidence_boundary": {
    "agents_or_robots_allowed": false,
    "aggregate_before_twelve_complete_records_allowed": false,
    "automation_may_substitute_for_manual_play": false,
    "observer_and_executor_attestation_required": true,
    "pii_collection_allowed": false,
    "project_members_allowed": false,
    "real_external_human_required_for_every_scenario": true
  },
  "manual_check_contract": [
    "product_entry_reachable",
    "instructions_clear",
    "objective_clear",
    "recommended_assist_clear",
    "scenario_loaded",
    "legal_operation_completed",
    "success_state_observed",
    "failure_state_observed",
    "score_observed",
    "reset_observed",
    "retry_observed",
    "replay_v1_saved"
  ],
  "matrix_id": "phase4_launch12_human_manual_play_v1",
  "pack_contract": {
    "category_counts": {
      "break_cue_control": 2,
      "continuous_position": 2,
      "pocket_angle": 2,
      "side_spin_cushion": 3,
      "stun_follow_draw": 3
    },
    "coverage_matrix_path": "assets/training/phase4/coverage_matrix.json",
    "coverage_matrix_sha256": "sha256:eb700ff28ee79b12ce6da59ae944d3437e3f8864ec60864cc55daf56c361d2a9",
    "pack_id": "billiardgl_phase4_launch12_v1",
    "pack_path": "assets/training/phase4/training_pack_v1.json",
    "pack_sha256": "sha256:1ed81b57ffc2b6d910b405291571349e29d1129d4d886d2eaaca0e2bf71af018"
  },
  "protocol_path": "docs/art/phase4-manual-play-protocol.md",
  "records": [
    {
      "attempt_seed": 0,
      "attestations": {
        "executor": {
          "accepted": "PENDING",
          "signed_utc": "PENDING",
          "signer_code": "PENDING",
          "statement_version": "phase4_manual_play_attestation_v1"
        },
        "observer": {
          "accepted": "PENDING",
          "observer_id": "PENDING",
          "signed_utc": "PENDING",
          "statement_version": "phase4_manual_play_attestation_v1"
        }
      },
      "automation_binding": {
        "artifact_sha256": "PENDING",
        "attached": "PENDING",
        "failure_fixture_passed": "PENDING",
        "substitutes_for_manual_play": false,
        "success_fixture_passed": "PENDING"
      },
      "category": "stun_follow_draw",
      "description_zh_cn": "\u5c061\u53f7\u7403\u6253\u5165\u5e95\u888b\uff0c\u5e76\u8ba9\u6bcd\u7403\u505c\u5728\u78b0\u649e\u70b9\u9644\u8fd1\u3002",
      "environment": {
        "asset_bundle_sha256": "PENDING",
        "build_sha256": "PENDING",
        "device_code": "PENDING",
        "dpi": "PENDING",
        "executable_version": "PENDING",
        "gpu_device": "PENDING",
        "input_devices": "PENDING",
        "logical_viewport_px": "PENDING",
        "operating_system": "PENDING",
        "physical_viewport_px": "PENDING",
        "physics_profile_id": "PENDING",
        "physics_profile_sha256": "PENDING"
      },
      "executor": {
        "agent_or_robot": "PENDING",
        "executor_id": "PENDING",
        "project_member": "PENDING",
        "real_external_human": "PENDING"
      },
      "initial_scenario_sha256": "sha256:44e05a6f5f234036ac58fab82240c5ff7fa3e814e2b5dca94ca9f380ce41ee0e",
      "manual_checks": [
        {
          "check_id": "product_entry_reachable",
          "notes": "PENDING",
          "result": "PENDING"
        },
        {
          "check_id": "instructions_clear",
          "notes": "PENDING",
          "result": "PENDING"
        },
        {
          "check_id": "objective_clear",
          "notes": "PENDING",
          "result": "PENDING"
        },
        {
          "check_id": "recommended_assist_clear",
          "notes": "PENDING",
          "result": "PENDING"
        },
        {
          "check_id": "scenario_loaded",
          "notes": "PENDING",
          "result": "PENDING"
        },
        {
          "check_id": "legal_operation_completed",
          "notes": "PENDING",
          "result": "PENDING"
        },
        {
          "check_id": "success_state_observed",
          "notes": "PENDING",
          "result": "PENDING"
        },
        {
          "check_id": "failure_state_observed",
          "notes": "PENDING",
          "result": "PENDING"
        },
        {
          "check_id": "score_observed",
          "notes": "PENDING",
          "result": "PENDING"
        },
        {
          "check_id": "reset_observed",
          "notes": "PENDING",
          "result": "PENDING"
        },
        {
          "check_id": "retry_observed",
          "notes": "PENDING",
          "result": "PENDING"
        },
        {
          "check_id": "replay_v1_saved",
          "notes": "PENDING",
          "result": "PENDING"
        }
      ],
      "manual_open_response": "PENDING",
      "pii_review": {
        "performed": "PENDING",
        "reviewer_observer_id": "PENDING",
        "status": "PENDING"
      },
      "recommended_assist": "basic",
      "replay_evidence": {
        "content_sha256": "PENDING",
        "declared_final_state_sha256": "PENDING",
        "executable_version": "PENDING",
        "file_sha256": "PENDING",
        "first_play_final_hash_matches": "PENDING",
        "first_play_final_state_sha256": "PENDING",
        "format": "PENDING",
        "format_version": "PENDING",
        "physics_profile_id": "PENDING",
        "physics_profile_sha256": "PENDING",
        "same_file_replayed_twice": "PENDING",
        "second_play_final_hash_matches": "PENDING",
        "second_play_final_state_sha256": "PENDING",
        "seed": "PENDING",
        "wrong_content_hash_rejection": {
          "error_code": "PENDING",
          "rejected": "PENDING"
        },
        "wrong_profile_hash_rejection": {
          "error_code": "PENDING",
          "rejected": "PENDING"
        },
        "wrong_profile_id_rejection": {
          "error_code": "PENDING",
          "rejected": "PENDING"
        }
      },
      "required_capabilities": [
        "training_scenario_v1"
      ],
      "scenario_file": "scenarios/launch_stop_shot_center_v1.training.json",
      "scenario_file_sha256": "sha256:ea90373a63ff83ccd94a9703e838df0eb497284b91ca908354ede8f713402eaf",
      "scenario_id": "launch_stop_shot_center_v1",
      "session": {
        "duration_ms": "PENDING",
        "ended_utc": "PENDING",
        "started_utc": "PENDING"
      },
      "status": "PENDING",
      "title_zh_cn": "\u4e2d\u6746\u5b9a\u7403",
      "trajectory_evidence": {
        "actual_endpoint_readable": "PENDING",
        "actual_legend_readable": "PENDING",
        "authority_after_preview_sha256": "PENDING",
        "authority_before_sha256": "PENDING",
        "predicted_endpoint_readable": "PENDING",
        "predicted_legend_readable": "PENDING",
        "preview_authority_unchanged": "PENDING",
        "tracks_distinguishable_without_color": "PENDING"
      }
    },
    {
      "attempt_seed": 0,
      "attestations": {
        "executor": {
          "accepted": "PENDING",
          "signed_utc": "PENDING",
          "signer_code": "PENDING",
          "statement_version": "phase4_manual_play_attestation_v1"
        },
        "observer": {
          "accepted": "PENDING",
          "observer_id": "PENDING",
          "signed_utc": "PENDING",
          "statement_version": "phase4_manual_play_attestation_v1"
        }
      },
      "automation_binding": {
        "artifact_sha256": "PENDING",
        "attached": "PENDING",
        "failure_fixture_passed": "PENDING",
        "substitutes_for_manual_play": false,
        "success_fixture_passed": "PENDING"
      },
      "category": "stun_follow_draw",
      "description_zh_cn": "\u4f7f\u7528\u9ad8\u6746\u8fdb\u7403\uff0c\u5e76\u8ba9\u6bcd\u7403\u8d8a\u8fc7\u78b0\u649e\u70b9\u8fdb\u5165\u524d\u65b9\u76ee\u6807\u533a\u3002",
      "environment": {
        "asset_bundle_sha256": "PENDING",
        "build_sha256": "PENDING",
        "device_code": "PENDING",
        "dpi": "PENDING",
        "executable_version": "PENDING",
        "gpu_device": "PENDING",
        "input_devices": "PENDING",
        "logical_viewport_px": "PENDING",
        "operating_system": "PENDING",
        "physical_viewport_px": "PENDING",
        "physics_profile_id": "PENDING",
        "physics_profile_sha256": "PENDING"
      },
      "executor": {
        "agent_or_robot": "PENDING",
        "executor_id": "PENDING",
        "project_member": "PENDING",
        "real_external_human": "PENDING"
      },
      "initial_scenario_sha256": "sha256:f8740ea9b86918b9a80a2f6b62a8b6ff4427b2c5338e2908bff89a8802a4c0ae",
      "manual_checks": [
        {
          "check_id": "product_entry_reachable",
          "notes": "PENDING",
          "result": "PENDING"
        },
        {
          "check_id": "instructions_clear",
          "notes": "PENDING",
          "result": "PENDING"
        },
        {
          "check_id": "objective_clear",
          "notes": "PENDING",
          "result": "PENDING"
        },
        {
          "check_id": "recommended_assist_clear",
          "notes": "PENDING",
          "result": "PENDING"
        },
        {
          "check_id": "scenario_loaded",
          "notes": "PENDING",
          "result": "PENDING"
        },
        {
          "check_id": "legal_operation_completed",
          "notes": "PENDING",
          "result": "PENDING"
        },
        {
          "check_id": "success_state_observed",
          "notes": "PENDING",
          "result": "PENDING"
        },
        {
          "check_id": "failure_state_observed",
          "notes": "PENDING",
          "result": "PENDING"
        },
        {
          "check_id": "score_observed",
          "notes": "PENDING",
          "result": "PENDING"
        },
        {
          "check_id": "reset_observed",
          "notes": "PENDING",
          "result": "PENDING"
        },
        {
          "check_id": "retry_observed",
          "notes": "PENDING",
          "result": "PENDING"
        },
        {